item_id,name,stock_count
HRE81Y9NF009Y,Phillips' Milk Of Magnesia 12 fl oz,
CG6GPNR5WC0GA,LORA Organic Tempranillo & Syrah 750ml,
2RJ4KH3AWG7CC,Monkey in Paradise Vodka 750ml,
SSRJCCCNTY8T8,Sir Edwards's Blended Scotch Whiskey 700ml,
2412HM706RRFR,Anee Calvados Fine 700,
RN818CDY75A0J,Wd 40 Smart Straw Spray Lubricant | 8 Oz Aerosol Can,
RV58W2VYAA5Y0,Swan Rubbing Alcohol | Isopropyl | 70% | With Wintergreen And Glycerin,
M6SFHWN9CHZC8,Denizens Cool Breeze Stout,
R49YVE8M0C3FG,Classico Roasted Garlic Pasta Sauce | 24 Oz Jar,
3YP6AZZ1V46DJ,California Sun Dry Dried Julienne Cut Tomatoes With Herbs,
NK5W6Y936RQJG,Beneful Purina With Real Chicken Healthy Puppy Dry Dog Food,
B0A1TBJJSB2YY,Game Blue Natural Leaf Cigarillo,
0X0V7X1GN84RY,Gain Liquid Laundry Detergent | Original Fresh | 25 Oz Bottle,
BMBMKDYX208X0,diet pepsi 12oz,
4DWH9JBG0BATR,Carmex Classic Lip Balm 0.35 Oz,
REVCXSBYEGBAE,Bauducco Panettone Mini Chocolate Chips 2.8oz,
8959QHCDA3QHE,Lost Rhino Final Glide Hefeweizen 6c,
TBGCZZX1E1NGA,LF Deli Rolls,
TKYMJS55RJDKY,9di Dante Extra Dry Vermouth 750ml,
T3W6F68VWJWVA,Patron Teq Reposado 80 375ml,
JXBR4S50Z2AER,Updated Item Name,
9GV70QDV3WKD2,TEST_ITEM_1,
3D1EF93XVMSSY,ChapStick Classic Classic Medicated Lip Balm Tube | 0.15 Oz,
RSX57D2AKJNHP,ChapStick Classic Supermint Flavor Skin Protectant Flavored Lip Balm Tube | 0.15 Oz,
P3CPWVSYF5YXW,Ritter Sport Dark Chocolate With Whole Hazelnuts- 3.5oz,
CJ742B67ZF1F0,Dove Body Wash Deep Moisture 20oz,
CJKBMX495F1CA,belVita Chocolate Breakfast Biscuits - 5 Packs,
NE14VNQWE5SGJ,Iberia Black Beans 16 Oz,
S7P0BZFBM2MEW,Nail Clipper,
JNQYNNQSSQMM6,Coppertone S Sport spf50,
5GMDN6T69VSG0,Mt.Olive Koshet Petite Dills 46oz,
2EK8463EKKDW0,Hunts Tomato Puree 29oz,
BA6NF7NN9SBGW,Fruity Pebbles,
KAXMEZBR0X5P8,Sunsweet Prune Juice,
FJC11CPMZYRFE,Aslin Double Orange Starfish,
NGZ5BB6TYPQK0,Gift card,
DXNTHMY4TEKDR,Sweet Baby Ray Buffalo Wing Sauce 16oz,
0FK1BEPCX3D1C,Powerade Fruit Punch 20oz,
W053X1ZEVHPW2,Doritos Brazin' Buffalo And Ranch,
KVHX29NRWR22E,Banana Sport SS  50,
DVZX020VH8XPP,Ziploc Sandwich Bags,
EBTXPGC289JXY,Woolite Delicates Wash Liquid Laundry Detergent,
TJ0EK6C7C1PB4,Wish-Bone Light Ranch Salad Dressing | 15 Fl Oz,
V4XX9FFSR8EAP,Mountain Dew Diet 2L,
A06HHJGHRZ9SM,Vaseline Intensive Care Aloe Soothe Body Lotion - 200ml,
GPPCEEGY1JF8G,Vaseline 100% Pure Petroleum Jelly | Original | Skin Protectant,
7030NPZPZ386C,Tide + Pods Pacs 4 In 1 With Downy April Fresh Detergent,
1AAFJ66QEB5K0,SunChips Whole Grain Snacks Original 7 Oz,
CW2J9MP7G76WP,Starbucks Medium Roast K-Cup Coffee Pods — Breakfast Blend For Keurig Brewers — 1 Box (22 Pods),
F6RBMTH8842GA,Star Lytes Candle Linen Fresh 3 Oz,
2J7G8MZV0DYZP,Salute Pocket Corkscrew And Bottle Opener,
FFGP8NNBGVCE6,Reynolds Wrap 37.5 Sq Ft Grill Heavy Duty Non-Stick Aluminum Foil,
DC5AZFHF07T0R,Progresso Soup | Traditional | Chicken Cheese Enchilada Flavor | Gluten Free | 18.5 Oz Cans,
894D65C71RN4W,Progresso Protein Mediterranean Style Lentil Soup,
4HN0AHKTQ0B7C,Pringles Pizza Flavored Potato Crisps Chips - 5.5oz,
3W4YAJ1W944DC,Port city Fruitoss 4/16oz,
6Z86SM2TACBRE,"plunger 15""",
V8G76D0C2EN9C,Pedigree Food For Dogs | Completed Nutrition | Roasted Chicken | Rice & Vegetable Flavor | Small Dog | Adult 56 Oz,
XHAW7873F3N96,Parducci Mendocino Small Lot Pinot Noir 2021,
1B36WBDN8F5AR,Nongshim Udon Premium Noodle Soup Bowl,
GBMZJ6BCGV4WY,Neosporin Original First Aid Antibiotic Ointment With Bacitracin | Zinc For 24-hour Protection - 0.5 Oz,
9X8TPQ28NK3EY,Nando's Medium Peri-Peri Sauce 9.2 Oz. Bottle,
8SZ95CZDDYTNP,Meow Mix Original Choice Dry Cat Food | 3.15-Pound Bag,
ZYP3N6V8GWWWW,McCormick Peppercorn Medley Grinder - .85oz,
526TH4F2Z05JE,McCormick Chicken Gravy Mix .87oz,
F14YAR2YGYVST,Amy's Bowls Asian Dumplings 8.5oz,
EMHGR1HAR9N5E,Mccormick  Parsley Flakes .25oz,
NPG299Z82CFEE,Mccormick  ground sage .6oz,
GHN8JH2TD3PT2,Mccormick  Basil Leaves 0.62oz,
0GZDFC4PQN5TC,Marie Callender's Sweet And Savory Sesame Chicken Bowl Frozen Meal,
G1D46E1V6M6EE,Lysol Power Toilet Bowl Cleaner 24 Fl. Oz. Plastic Bottle,
BPG2D1WAWZYQG,Lipton Black Tea Bags 20ct,
8W8KK3DSRZ88A,Little Yering Pinot Noir,
X2SHAACJ9SD5A,La Flor Thyme Tomillo 1 Oz,
WGXA09CFCFMZP,La Flor Onion Powder 3 Oz,
VZ2992V84J6V4,Kleenex Tissues | White | Rainfall Blue | 3 Ply,
5C8AY2894RD1M,Kettle Brand Organic Sea Salt Potato Chips 5.000 Oz,
YY51Z5ADRFAR2,Jimmy Dean Sandwiches | Bacon | Egg & Cheese | Croissant,
WBF0KH3JSEE32,Huggies Little Snugglers Baby Diapers – (Select Size And Count),
F8SXYYYKBYDK6,Goya Blackeye Peas | Premium,
1ED22XC6PN41M,Good Thins Simply Salt Rice Snacks Gluten Free Crackers | 3.5 Oz,
J6DXT2D8DCBT0,Good & Gather 73/27 Ground Beef 1lb,
FK0J1328XXN5J,Glad Cling Wrap | Clear Food,
T3MV9YT7XH43G,Gillette Venus Extra Smooth Green Women's Razor Handle + 2 Blade Refills,
53XN5H4A2R0PC,Garofalo Organic Pasta 17.6 Oz (Lumaca Rigata),
Z2H5K6PHB8YSJ,FormulaShell 550049475 Motor Oil | 1 Quart,
HGDRMJ57CAZQT,Finish Ultimate Dishwasher Detergent Tabs,
K8068RFSRSWAJ,Fantastik Multi-Surface Disinfectant Degreaser | Herbal | 32 Oz Spray Bottle,
3J5KXS702V0XP,Essential Everyday Sandwich Bags | Pleated | Fold & Close | Larger,
G475NK1HNR82R,Essential Everyday Lawn & Leaf Bags | Flap Top | 39 Gallon,
4V668SF9CEDMJ,Cutex Strength Shield Nail Polish Remover | 6.7 Fl Oz,
AYVA571DPMJ88,Crest 3D White Arctic Fresh Teeth Whitening Toothpaste 2.7 Oz,
QHDHXW09HKNA2,Crest Pro-Health Advanced Gum Protection Toothpaste - 5.1oz,
3MM4GVP97ASBE,Colgate Maximum Strength Toothpaste Sensitive Prevent & Repair With Whitening Gentle Mint,
01E59Q9FHE9P4,Artisan Tropic Cassava Strips Sea Salt - 4.5oz,
W8NTRC0FD934A,Clarisse Cotton Balls Triple Size,
8SJH1H2JGWVJ2,Chips Ahoy! Chocolate Chip - Chewy Cookies - Family Size - 19.5oz,
SM6M8VMDQX9RW,Cheez-It Baked Snack Cheese Crackers | Buffalo Wing | 12.4 Oz,
MM1RZA1ERDEHW,Cheetos | Puffs | Flamin' Hot Flavored | Cheese Flavored Snacks,
M6S22GARMWEY2,Carlsberg Beer - 11.2 Oz,
YD533HHZVC6S8,Blueberry,
XTVN3MKB3T63P,Blueberries 11 Oz,
P9G7YQ4GRV0HE,Biutiful Cava Brut Rose 750ml,
BK4WZ7AK55ZJW,belVita Cinnamon Brown Sugar Breakfast Biscuits - 5 Packs,
N0VY5CQEYDER8,Badia Whole Cloves - 1.25oz,
SJRPMNJM7Q8MT,Badia Spices Sage Ground,
D93BV5BZP33JG,Badia Celery Salt – 4.5 Oz,
PHA8GGTK8GEJ0,G.H. Cretors Popcorn Caramel Flavored 4.5 Ounce -- 6 Per Case,
Q2MS943ATD1A0,5 Gum Watermelon Prism Sugar Free Chewing Gum | Single Pack,
6F5MJP82N5356,Degree Men Original Protection Antiperspirant Deodorant Sport | 1.7 Oz,
3XDWXRC46NXG4,Michel & Augustin Milk Chocolate & M Caramel,
Y8EVY0TYRCWK6,Lotus Biscoff Sandwich 5.29 oz,
970HZWGMXEGRC,Baron Philippe De Rothschild Escudo Rojo Reserva Pinot Noir,
A6EAKKZ4E0DDG,Little Salad Bar Spinach,
A382P8Y67DVNM,Twinings Of London Lady Grey Decaffeinated Black Tea Bags,
V032EE54YV83W,Reynolds Kitchens Parchment Paper 50 Sq. Ft. Box,
C3N0FAQKRHR6W,Mr & Mrs T Original Margarita Mix 33.8 Fl Oz,
PDSXBST0SRXS4,McCormick Mild Taco Seasoning Mix 1oz,
6FZB0VB49XN22,Doritos Tortilla Chips Nacho Cheese Flavored 2 3/4 Oz,
